{"$defs":{"adr_id":{"pattern":"^ADR-[0-9]{4}$","type":"string"},"chapter_dependency":{"additionalProperties":false,"properties":{"expected_owner_role_id":{"$ref":"#/$defs/non_blank"},"required_rule_id":{"$ref":"#/$defs/rule_id"}},"required":["required_rule_id","expected_owner_role_id"],"type":"object"},"check_id":{"pattern":"^CHK-[A-Z0-9]+(?:-[A-Z0-9]+)*$","type":"string"},"fixture_id":{"pattern":"^FIX-[A-Z0-9]+(?:-[A-Z0-9]+)*$","type":"string"},"non_blank":{"minLength":1,"pattern":"^(?!\\s)(?!.*\\s$)[^\\u0000-\\u001F\\u007F-\\u009F]+$","type":"string"},"non_empty_fixture_id_array":{"items":{"$ref":"#/$defs/fixture_id"},"minItems":1,"type":"array","uniqueItems":true},"non_empty_non_blank_array":{"items":{"$ref":"#/$defs/non_blank"},"minItems":1,"type":"array","uniqueItems":true},"requirement_id":{"pattern":"^(?:(?:REQ|ENT)-[A-Z0-9]+(?:-[A-Z0-9]+)*|P[0-3]-[1-9][0-9]*)$","type":"string"},"rule_id":{"pattern":"^(?:[A-Z0-9]+-){2,}[0-9]{3}$","type":"string"}},"$id":"urn:ifl:standards:schema:chapter:v1","$schema":"https://json-schema.org/draft/2020-12/schema","additionalProperties":false,"properties":{"applicability":{"$ref":"#/$defs/non_empty_non_blank_array"},"check_ids":{"items":{"$ref":"#/$defs/check_id"},"minItems":1,"type":"array","uniqueItems":true},"compliant_example_ids":{"$ref":"#/$defs/non_empty_fixture_id_array"},"exception_policy":{"$ref":"#/$defs/non_blank"},"id":{"$ref":"#/$defs/non_blank"},"negative_fixture_ids":{"$ref":"#/$defs/non_empty_fixture_id_array"},"non_compliant_example_ids":{"$ref":"#/$defs/non_empty_fixture_id_array"},"owner_role_id":{"$ref":"#/$defs/non_blank"},"positive_fixture_ids":{"$ref":"#/$defs/non_empty_fixture_id_array"},"rationale":{"$ref":"#/$defs/non_blank"},"rationale_adr_ids":{"items":{"$ref":"#/$defs/adr_id"},"minItems":1,"type":"array","uniqueItems":true},"required_evidence_kinds":{"$ref":"#/$defs/non_empty_non_blank_array"},"required_rule_dependencies":{"items":{"$ref":"#/$defs/chapter_dependency"},"type":"array","uniqueItems":true},"requirement_id":{"$ref":"#/$defs/requirement_id"},"review_cadence":{"$ref":"#/$defs/non_blank"},"review_checklist_ids":{"$ref":"#/$defs/non_empty_non_blank_array"},"rule_ids":{"items":{"$ref":"#/$defs/rule_id"},"minItems":1,"type":"array","uniqueItems":true},"schema_version":{"const":1},"title":{"$ref":"#/$defs/non_blank"}},"required":["schema_version","id","requirement_id","title","owner_role_id","rationale","applicability","rule_ids","rationale_adr_ids","compliant_example_ids","non_compliant_example_ids","check_ids","positive_fixture_ids","negative_fixture_ids","required_evidence_kinds","review_checklist_ids","exception_policy","review_cadence","required_rule_dependencies"],"title":"IFL Enterprise Chapter Metadata v1","type":"object"}
