{"applicability":["startup, rendering, memory, energy, and network performance","offline, degraded, recovery, and retry behavior"],"check_ids":[],"compliant_example_ids":[],"exception_policy":"Bind the exact journey and budget, comparable measured delta, user impact, owner, approval, compensating controls, expiry, and remediation plan; no exception permits unbounded memory, retry, background work, or silent data loss.","id":"performance-resilience","negative_fixture_ids":[],"non_compliant_example_ids":[],"owner_role_id":"Performance Owner","positive_fixture_ids":[],"rationale":"Owned contextual budgets and explicit resilience semantics make regressions and degraded behavior measurable without inventing universal thresholds.","rationale_adr_ids":["ADR-0011"],"required_evidence_kinds":["final_ai_review/v1"],"required_rule_dependencies":[{"expected_owner_role_id":"Operability Owner","required_rule_id":"OBS-METRIC-001"},{"expected_owner_role_id":"Operability Owner","required_rule_id":"OBS-CORR-001"},{"expected_owner_role_id":"Testing Owner","required_rule_id":"TEST-PERF-001"},{"expected_owner_role_id":"Testing Owner","required_rule_id":"TEST-EVIDENCE-001"}],"requirement_id":"ENT-PERFORMANCE","review_cadence":"Review after material product, architecture, device, toolchain, dependency, or incident changes and on the organization-defined product performance cadence with comparable methodology.","review_checklist_ids":["REVIEW-STANDARDS-1.0-FINAL-AI"],"rule_ids":["PERF-START-001","PERF-FRAME-001","PERF-MEM-001","PERF-ENERGY-001","PERF-NET-001","PERF-BUDGET-001","PERF-REGRESS-001","RES-OFFLINE-001","RES-RETRY-001"],"schema_version":1,"title":"Performance and Resilience"}
