{"applicability":["Every Swift target governed by the IFL iOS Standards.","Callback, delegate, notification, and Objective-C boundaries adapted to async Swift."],"check_ids":[],"compliant_example_ids":[],"exception_policy":"No exception permits a known data race, unowned task, or unsafe continuation; temporary legacy containment records the exact boundary, owner, expiry, compensating control, and removal plan.","id":"swift-6-concurrency","negative_fixture_ids":[],"non_compliant_example_ids":[],"owner_role_id":"Concurrency Chapter Owner","positive_fixture_ids":[],"rationale":"Swift 6 strict concurrency makes isolation, crossing, lifetime, and cancellation obligations explicit across every architecture profile.","rationale_adr_ids":["ADR-0010"],"required_evidence_kinds":["final_ai_review/v1"],"required_rule_dependencies":[],"requirement_id":"ENT-CONCURRENCY","review_cadence":"At least annually and whenever the supported Swift language mode, concurrency runtime, or a shared asynchronous adapter materially changes.","review_checklist_ids":["REVIEW-STANDARDS-1.0-FINAL-AI"],"rule_ids":["CONC-ISO-001","CONC-SEND-001","CONC-TASK-001","CONC-CANCEL-001","CONC-CONT-001","CONC-LEGACY-001"],"schema_version":1,"title":"Swift 6 Concurrency"}
