{"applicability":["Every app-owned record, file, preference, database row, credential, key, cache, queue, index, attachment, log buffer, backup candidate, and offline copy.","Every feature that changes data purpose, sensitivity, store, retention, deletion, backup, migration, or offline behavior."],"check_ids":[],"compliant_example_ids":[],"exception_policy":"A temporary exception binds the exact data class, store, affected artifact digest, compensating control, accountable owner, expiry, and removal plan; it cannot permit plaintext restricted storage, permanent retention, partial deletion, destructive migration, or unbounded offline data.","id":"data-lifecycle","negative_fixture_ids":[],"non_compliant_example_ids":[],"owner_role_id":"Data Lifecycle Owner","positive_fixture_ids":[],"rationale":"One canonical classification and explicit storage-to-deletion lifecycle prevents features and downstream standards from applying contradictory protection, retention, and recovery behavior.","rationale_adr_ids":["ADR-0001","ADR-0002"],"required_evidence_kinds":["final_ai_review/v1"],"required_rule_dependencies":[{"expected_owner_role_id":"Architecture Owner","required_rule_id":"CORE-DEP-001"},{"expected_owner_role_id":"Architecture Owner","required_rule_id":"CORE-DEP-002"},{"expected_owner_role_id":"Architecture Owner","required_rule_id":"CORE-DEP-003"}],"requirement_id":"ENT-DATA","review_cadence":"At least annually and whenever a new data use, store, backup behavior, retention obligation, cryptographic policy, migration framework, or offline capability is introduced.","review_checklist_ids":["REVIEW-STANDARDS-1.0-FINAL-AI"],"rule_ids":["DATA-CLASS-001","DATA-STORE-001","DATA-CRYPT-001","DATA-RET-001","DATA-DELETE-001","DATA-CACHE-001","DATA-BACKUP-001","DATA-MIGRATE-001","DATA-OFFLINE-001"],"schema_version":1,"title":"Data Lifecycle"}
