{"applicability":["Every iOS feature, extension, SDK, analytics or diagnostic path, permission flow, tracking technology, and disclosure that collects, derives, processes, transmits, stores, or deletes product data"],"check_ids":[],"compliant_example_ids":[],"exception_policy":"Privacy exceptions require designated human privacy or legal authority, exact purpose and data scope, affected processing, compensating controls, owner, expiry, review event, and removal or deletion plan.","id":"privacy-compliance","negative_fixture_ids":[],"non_compliant_example_ids":[],"owner_role_id":"Privacy Owner","positive_fixture_ids":[],"rationale":"Keep product-data use owned, declared, purpose-bound, minimal, consent-aware, and aligned with platform manifests and human-approved disclosure obligations.","rationale_adr_ids":["ADR-0001"],"required_evidence_kinds":["final_ai_review/v1"],"required_rule_dependencies":[{"expected_owner_role_id":"Data Lifecycle Owner","required_rule_id":"DATA-CLASS-001"},{"expected_owner_role_id":"Security Owner","required_rule_id":"MSEC-LOG-001"}],"requirement_id":"ENT-PRIVACY","review_cadence":"Quarterly and before release when data fields, purposes, recipients, SDKs, tracking, required-reason APIs, retention, consent behavior, or disclosures change.","review_checklist_ids":["REVIEW-STANDARDS-1.0-FINAL-AI"],"rule_ids":["PRIV-CONSENT-001","PRIV-DISCLOSE-001","PRIV-INV-001","PRIV-MANIFEST-001","PRIV-MIN-001","PRIV-REASON-001"],"schema_version":1,"title":"Privacy and Compliance"}
