{"applicability":["Every customer-visible UIKit or SwiftUI screen, extension, notification, widget, reusable component, navigation flow, custom interaction, animation, and localized resource"],"check_ids":[],"compliant_example_ids":[],"exception_policy":"Accessibility exceptions require named human accessibility authority, the exact affected capability and surface, an equivalent access path, owner, expiry, review event, and removal plan; they cannot waive access to an essential task.","id":"accessibility-global-readiness","negative_fixture_ids":[],"non_compliant_example_ids":[],"owner_role_id":"Accessibility Owner","positive_fixture_ids":[],"rationale":"Provide equivalent semantic, visual, motion, input, language, direction, and locale experiences while preserving Presenter-owned formatting and View-owned platform mechanics.","rationale_adr_ids":["ADR-0005"],"required_evidence_kinds":["final_ai_review/v1"],"required_rule_dependencies":[{"expected_owner_role_id":"SwiftUI Profile Owner","required_rule_id":"SWUI-VIEW-001"},{"expected_owner_role_id":"iOS Profile Owner","required_rule_id":"UI-HUMBLE-001"},{"expected_owner_role_id":"iOS Profile Owner","required_rule_id":"UI-HUMBLE-002"},{"expected_owner_role_id":"iOS Profile Owner","required_rule_id":"UI-HUMBLE-003"},{"expected_owner_role_id":"iOS Profile Owner","required_rule_id":"UI-HUMBLE-004"},{"expected_owner_role_id":"iOS Profile Owner","required_rule_id":"UIKIT-RENDER-001"}],"requirement_id":"ENT-ACCESSIBILITY","review_cadence":"Quarterly and before release when critical flows, design systems, supported locales, custom controls, navigation, animation, or platform accessibility APIs change.","review_checklist_ids":["REVIEW-STANDARDS-1.0-FINAL-AI"],"rule_ids":["A11Y-CONTRAST-001","A11Y-FOCUS-001","A11Y-INPUT-001","A11Y-MOTION-001","A11Y-TYPE-001","A11Y-VOICE-001","I18N-FORMAT-001","I18N-LOCALIZE-001","I18N-PLURAL-001","I18N-RTL-001"],"schema_version":1,"title":"Accessibility and Global Readiness"}
