{"applicability":["production iOS applications and extensions","analytics, crash, metrics, traces, and diagnostic buffering"],"check_ids":[],"compliant_example_ids":[],"exception_policy":"Bind the exact signal, fields, data class, purpose, owner, approving authorities, compensating controls, expiry, and removal plan; no exception permits secrets, undisclosed collection, or unbounded cardinality, buffering, retry, or retention.","id":"observability-operability","negative_fixture_ids":[],"non_compliant_example_ids":[],"owner_role_id":"Operability Owner","positive_fixture_ids":[],"rationale":"Production diagnosis requires typed, correlated, privacy-safe, bounded, and owned signals whose analytics meaning remains outside Views.","rationale_adr_ids":["ADR-0001"],"required_evidence_kinds":["final_ai_review/v1"],"required_rule_dependencies":[{"expected_owner_role_id":"Security Owner","required_rule_id":"MSEC-LOG-001"},{"expected_owner_role_id":"Privacy Owner","required_rule_id":"PRIV-MIN-001"},{"expected_owner_role_id":"Privacy Owner","required_rule_id":"PRIV-DISCLOSE-001"},{"expected_owner_role_id":"Data Lifecycle Owner","required_rule_id":"DATA-CLASS-001"},{"expected_owner_role_id":"Data Lifecycle Owner","required_rule_id":"DATA-RET-001"}],"requirement_id":"ENT-OBSERVABILITY","review_cadence":"Review material instrumentation changes immediately and the complete owned taxonomy, retention, buffers, dashboards, and alerts on the organization-defined operating cadence and after incidents or policy changes.","review_checklist_ids":["REVIEW-STANDARDS-1.0-FINAL-AI"],"rule_ids":["OBS-EVENT-001","OBS-CRASH-001","OBS-METRIC-001","OBS-CORR-001","OBS-REDACT-001","OBS-TAXON-001","OBS-BUFFER-001","OBS-OWNER-001"],"schema_version":1,"title":"Observability and Operability"}
