{"applicability":["SwiftUI screens, components, presentation stores, navigation adapters, and hosting integrations.","New SwiftUI features and incremental UIKit-to-SwiftUI migrations."],"check_ids":[],"compliant_example_ids":[],"exception_policy":"No exception permits business decisions, product-facing formatting, business dependency construction, unstable identity, or unscoped work in a View; performance exceptions are measured, owned, expiring, and semantics-preserving.","id":"swiftui-production","negative_fixture_ids":[],"non_compliant_example_ids":[],"owner_role_id":"SwiftUI Profile Owner","positive_fixture_ids":[],"rationale":"SwiftUI remains a rendering adapter when product state is display-ready, local state is UX-only, task and identity lifetimes are explicit, and UIKit interoperability preserves semantics.","rationale_adr_ids":["ADR-0005","ADR-0009","ADR-0010"],"required_evidence_kinds":["final_ai_review/v1"],"required_rule_dependencies":[{"expected_owner_role_id":"iOS Profile Owner","required_rule_id":"UI-HUMBLE-001"},{"expected_owner_role_id":"iOS Profile Owner","required_rule_id":"UI-HUMBLE-002"},{"expected_owner_role_id":"iOS Profile Owner","required_rule_id":"UI-HUMBLE-003"},{"expected_owner_role_id":"iOS Profile Owner","required_rule_id":"UI-HUMBLE-004"},{"expected_owner_role_id":"iOS Profile Owner","required_rule_id":"UI-ISOLATION-001"},{"expected_owner_role_id":"Concurrency Chapter Owner","required_rule_id":"CONC-ISO-001"},{"expected_owner_role_id":"Concurrency Chapter Owner","required_rule_id":"CONC-CANCEL-001"}],"requirement_id":"ENT-SWIFTUI","review_cadence":"At least annually, when the supported SwiftUI Observation or navigation model changes, and after a material performance or state-restoration incident.","review_checklist_ids":["REVIEW-STANDARDS-1.0-FINAL-AI"],"rule_ids":["SWUI-STATE-001","SWUI-VIEW-001","SWUI-LIFE-001","SWUI-ID-001","SWUI-NAV-001","SWUI-PERF-001","SWUI-INTEROP-001"],"schema_version":1,"title":"SwiftUI Production"}
