{"applicability":["executable iOS production code and public contracts","concurrency, accessibility, UI smoke, and performance evidence"],"check_ids":[],"compliant_example_ids":[],"exception_policy":"Bind the exact untested executable behavior, risk, unavailable signal, alternative evidence, owner, approver, expiry, and remediation plan; documentation is not executable behavior and self-reported output is not evidence.","id":"modern-testing","negative_fixture_ids":[],"non_compliant_example_ids":[],"owner_role_id":"Testing Owner","positive_fixture_ids":[],"rationale":"Risk-proportionate deterministic tests and factual evidence protect executable behavior without imposing TDD or runtime gates on documentation and metadata.","rationale_adr_ids":["ADR-0011"],"required_evidence_kinds":["final_ai_review/v1"],"required_rule_dependencies":[{"expected_owner_role_id":"Concurrency Chapter Owner","required_rule_id":"CONC-TASK-001"},{"expected_owner_role_id":"Concurrency Chapter Owner","required_rule_id":"CONC-CANCEL-001"},{"expected_owner_role_id":"Concurrency Chapter Owner","required_rule_id":"CONC-CONT-001"},{"expected_owner_role_id":"Accessibility Owner","required_rule_id":"A11Y-VOICE-001"},{"expected_owner_role_id":"Accessibility Owner","required_rule_id":"A11Y-TYPE-001"},{"expected_owner_role_id":"Accessibility Owner","required_rule_id":"A11Y-CONTRAST-001"},{"expected_owner_role_id":"Accessibility Owner","required_rule_id":"A11Y-MOTION-001"},{"expected_owner_role_id":"Accessibility Owner","required_rule_id":"A11Y-FOCUS-001"},{"expected_owner_role_id":"Accessibility Owner","required_rule_id":"A11Y-INPUT-001"}],"requirement_id":"ENT-TESTING","review_cadence":"Review strategy after material contract, concurrency, accessibility, critical-journey, toolchain, or performance changes and review suite health on the organization-defined engineering cadence.","review_checklist_ids":["REVIEW-STANDARDS-1.0-FINAL-AI"],"rule_ids":["TEST-BOUNDARY-001","TEST-ASYNC-001","TEST-CONTRACT-001","TEST-ARCH-001","TEST-SNAPSHOT-001","TEST-A11Y-001","TEST-SMOKE-001","TEST-PERF-001","TEST-EVIDENCE-001","TEST-NAME-001"],"schema_version":1,"title":"Modern Testing and Evidence"}
