{"applicability":["All production iOS targets, extensions, SDK integrations, network adapters, external input handlers, WebViews, credential stores, secret delivery, and logging paths"],"check_ids":[],"compliant_example_ids":[],"exception_policy":"Security exceptions require named human authority, exact asset and data class, residual risk, compensating controls, owner, expiry, review event, and removal plan.","id":"mobile-security","negative_fixture_ids":[],"non_compliant_example_ids":[],"owner_role_id":"Security Owner","positive_fixture_ids":[],"rationale":"Protect authentication, local storage, network trust, untrusted inputs, embedded web content, secrets, and operational events while consuming the Data Lifecycle-owned classification taxonomy.","rationale_adr_ids":["ADR-0002"],"required_evidence_kinds":["final_ai_review/v1"],"required_rule_dependencies":[{"expected_owner_role_id":"Data Lifecycle Owner","required_rule_id":"DATA-CLASS-001"}],"requirement_id":"ENT-SECURITY","review_cadence":"Quarterly and before release when assets, authentication, trust boundaries, public entry points, WebViews, secret delivery, logging, or security-relevant SDKs change.","review_checklist_ids":["REVIEW-STANDARDS-1.0-FINAL-AI"],"rule_ids":["MSEC-AUTH-001","MSEC-INPUT-001","MSEC-KEYCHAIN-001","MSEC-LOG-001","MSEC-NET-001","MSEC-SECRET-001","MSEC-THREAT-001","MSEC-WEB-001"],"schema_version":1,"title":"Mobile Security"}
