{"applicability":["direct and transitive dependencies, binaries, build tools, and plugins","release inventory, provenance, vulnerability, license, notice, and artifact integrity"],"check_ids":[],"compliant_example_ids":[],"exception_policy":"Only the consuming organization's approved supply-chain or legal policy authority may approve an exception, which binds the exact input, risk, scope, owner, approval, compensating controls, expiry, and remediation or removal plan.","id":"supply-chain-legal","negative_fixture_ids":[],"non_compliant_example_ids":[],"owner_role_id":"Security/Legal Owner","positive_fixture_ids":[],"rationale":"Releases require exact resolution, provenance, integrity, complete inventory, and human-owned vulnerability and legal decisions without invented organization policy values.","rationale_adr_ids":["ADR-0001"],"required_evidence_kinds":["final_ai_review/v1"],"required_rule_dependencies":[],"requirement_id":"ENT-SUPPLY","review_cadence":"Review every dependency or origin change and every release, plus organization-defined supply-chain/legal reviews and any vulnerability, license, provenance, package-manager, signing, or policy change.","review_checklist_ids":["REVIEW-STANDARDS-1.0-FINAL-AI"],"rule_ids":["SUP-PIN-001","SUP-PROV-001","SUP-HASH-001","SUP-INVENTORY-001","SUP-VULN-001","SUP-INTEGRITY-001","LEGAL-LICENSE-001","LEGAL-NOTICE-001"],"schema_version":1,"title":"Supply Chain and Legal Governance"}
